ID	Term	Abbreviation	Definition	ref
VHP0000079	European Medicines Agency	EMA 	An agency of the European Union (EU) in charge of the evaluation and supervision of pharmaceutical products.	https://www.ema.europa.eu/en/homepage
VHP0000080	College ter Beoordeling van Geneesmiddelen	CBG 	Medicines Evaluation Board. The Dutch authority that evaluates and regulates medicines for human and veterinary use. 	https://www.cbg-meb.nl/
VHP0000081		ZIN		
VHP0000082	College voor de toelating van gewasbeschermingsmiddelen en biociden	CTBG 	Dutch Board for the Authorisation of Plant Protection Products and Biocides.	https://www.ctgb.nl/
VHP0000085	European Centre for Ecotoxicology and Toxicology of Chemicals	ECTOC	"The European Centre for Ecotoxicology and Toxicology of Chemicals (ECETOC) is a scientific, non-profit, non-commercial and non-governmental association. Established in 1978, ECETOC's main objective is to identify, evaluate, and through such knowledge help industry to minimise any potentially adverse effects on human health and the environment that may arise from the manufacture and use of chemicals, biomaterials and pharmaceuticals."	https://en.wikipedia.org/wiki/European_Centre_for_Ecotoxicology_and_Toxicology_of_Chemicals
